[
  {
    "slug": "staskiewitz",
    "title": "The Crazy Bee",
    "tagline_en": "Beekeeper website & shop — WordPress + WooCommerce, Spessart",
    "tagline_de": "Imkerei-Website & Shop — WordPress + WooCommerce, Spessart",
    "year": 2026,
    "url": "https://thecrazybee.de",
    "status": "live",
    "tags": [
      "WordPress",
      "WooCommerce",
      "Shop",
      "Migration",
      "Handwerk",
      "DE"
    ],
    "summary_en": "WordPress site and WooCommerce shop for a family beekeeping business in the Spessart nature park. 26 content pages moved 1:1 from the old site and checked block by block, a honey shop with invoice and prepayment, 203 old addresses redirected so no search ranking is lost.",
    "summary_de": "WordPress-Website und WooCommerce-Shop für eine Familien-Imkerei im Naturpark Spessart. 26 Inhaltsseiten 1:1 vom alten Auftritt übernommen und Block für Block geprüft, Honig-Shop mit Rechnung und Vorkasse, 203 alte Adressen weitergeleitet, damit kein Ranking verloren geht.",
    "screenshot": "assets/staskiewitz-site.jpg",
    "screenshot_2x": "assets/staskiewitz-site.jpg",
    "mark": "staskiewitz",
    "layout": "feature",
    "featured": true,
    "order": 1,
    "case_de": {
      "ausgangslage": "Die Imkerei Staskiewitz – The Crazy Bee ist ein Familienbetrieb im Naturpark Spessart und verkauft Honig, Genießerprodukte und Imkereibedarf. Der bisherige Auftritt ist ein ePages-Shop.\n\nDie Aufgabe: Website und Shop auf WordPress mit WooCommerce umziehen, dabei ein neues Design umsetzen und nichts verlieren. Texte und Preise sollten 1:1 vom alten Auftritt kommen, erfunden werden durfte nichts. Bezahlt wird auf Rechnung oder per Vorkasse, ohne externe Zahlungsdienstleister. Und damit kein Ranking verloren geht, durfte beim Umzug keine bestehende Adresse ins Leere laufen.",
      "umsetzung": "Grundlage ist ein animiertes Design mit GSAP und Lenis, das ich zuerst als Entwurf gebaut und dann in ein eigenes WordPress-Theme überführt habe. Das Theme ist in Vorlagen für Startseite, Seiten, Beiträge und Fehlerseite zerlegt, bindet Skripte sauber über WordPress ein und unterstützt WooCommerce. Für die deutschen Shop-Pflichten läuft Germanized.\n\nDie 26 Inhaltsseiten habe ich übernommen und automatisch gegen das Original abgeglichen, auch Texte in zugeklappten Akkordeons. Der Katalog umfasst 126 Produkte in 30 Kategorien, erreichbar über Unterkategorien und Brotkrumen. Einzelne Artikel hat die Imkerei bewusst nicht übernehmen lassen. Die Steuersätze von 19 und 7 Prozent sind getrennt, den Grundpreis pro Kilogramm berechnet das Theme selbst. Die Regel „versandkostenfrei ab Mindestbestellwert, außer Imkereigeräte“ setzt ein Filter im Theme um, weil WooCommerce das nicht nach Kategorie trennt.\n\nDie Weiterleitungskarte mit 203 alten Adressen steckt im Theme selbst und nicht in einem Plugin, das man versehentlich abschalten könnte. Dazu kommen kanonische Adressen, Rechtstexte über das Plugin der Kanzlei des Kunden, die Online-Widerrufsfunktion nach § 356a BGB, eine Google-Karte, die erst per Klick lädt, und ein Newsletter-Formular für CleverReach.",
      "ergebnis": "Der Shop ist unter thecrazybee.de online. Für jede Adresse des alten Shops ist eine 301-Weiterleitung auf die passende neue Seite hinterlegt. Für neue Inhalte stehen im Editor sechs fertige Vorlagenblöcke bereit, und legt die Imkerei eine neue Warengruppe an, erscheint sie von selbst im Menü. Ändert die Kanzlei einen Rechtstext, ist die Seite ohne weiteres Zutun aktuell.\n\nMit Zustimmung des Kunden habe ich eine echte Testbestellung durchgeführt: Die Bestellung wurde angelegt, die Bestätigungsmail kam an, und der Auftrag erschien im Backend."
    }
  },
  {
    "slug": "hennerheede",
    "title": "Henner Heede",
    "tagline_en": "Creative Director portfolio — BOSS, MANGO, Baldessarini, Mustang",
    "tagline_de": "Creative-Director-Portfolio — BOSS, MANGO, Baldessarini, Mustang",
    "year": 2026,
    "url": "https://hennerheede.com",
    "status": "live",
    "tags": [
      "Portfolio",
      "Fashion",
      "WordPress",
      "Custom Theme",
      "Editorial",
      "DE/EN"
    ],
    "summary_en": "Editorial portfolio for a Munich-based Creative Director in fashion & lifestyle (BOSS, MANGO, Baldessarini, Mustang). Hand-coded WordPress theme, 12 pages, bilingual EN/DE: six case studies, Philosophy, CV timeline, About, Contact. Original brand logos 1:1, self-hosted font.",
    "summary_de": "Editorial-Portfolio für einen Münchner Creative Director in Fashion & Lifestyle (BOSS, MANGO, Baldessarini, Mustang). Handgeschriebenes WordPress-Theme, 12 Seiten, zweisprachig EN/DE: sechs Case Studies, Philosophy, CV-Zeitleiste, About, Contact. Original-Markenlogos 1:1.",
    "screenshot": "assets/hennerheede-site.jpg",
    "screenshot_2x": "assets/hennerheede-site.jpg",
    "mark": "hennerheede",
    "layout": "feature",
    "featured": true,
    "order": 2,
    "case_de": {
      "ausgangslage": "Henner Heede ist Creative Director für Fashion und Lifestyle in München, mit Stationen bei BOSS, MANGO, Baldessarini und Mustang. Entsprechend genau mussten Bild und Typografie in seinem Portfolio sitzen.\n\nAusgangspunkt war ein gekauftes Squarespace-Template. Dazu kamen KI-Mockups für die Bildsprache und handgezeichnete Skizzen des Kunden für den Aufbau der Seiten. Die Vorgaben: Markenlogos nur im Original, 1:1 und schwarz. Eine Editorial-Typografie mit engem Buchstabenabstand und großen Headlines. Nur Texte, die vom Kunden selbst stammen. Und später sollte er die Inhalte ohne Hilfe selbst pflegen können.",
      "umsetzung": "Squarespace setzte der Layout-Genauigkeit enge Grenzen, deshalb bin ich auf WordPress mit einem selbst geschriebenen Theme umgestiegen. Es besteht aus 15 PHP-Dateien, das gesamte Markup ist eigener Code. Case Studies und CV-Stationen sind eigene Inhaltstypen; gepflegt wird über native Eingabefelder mit der WordPress-Mediathek, ohne kostenpflichtige Plugins.\n\nDer Aufbau folgt den Skizzen des Kunden: Case Studies aus Bild-Text-Blöcken mit wechselnden Seiten, ein CV mit Markenlogo je Station, About mit drei Mood-Bildern. Eine Marke kann bis zu vier Projekte mit eigenem Titel, Text und Galerie tragen, und die Lightbox blättert nur innerhalb des jeweiligen Projekts. SVG-Logos lassen sich hochladen, Dateien mit Skripten oder Event-Handlern lehnt das Theme ab.\n\nFür Bewegung gilt eine einzige Easing-Kurve auf der ganzen Seite, Blöcke blenden beim Scrollen ein, und das Mausrad scrollt mit sanfter Trägheit, ganz ohne externe Bibliothek. Bei aktivierter Einstellung für reduzierte Bewegung ist alles aus. Auf dem Smartphone laufen Karussells über CSS-Scroll-Snap ohne JavaScript. Die Projektgalerie zeigt Bilder im Originalformat, sobald ein Motiv beim Zuschnitt mehr als ein Fünftel verlieren würde.",
      "ergebnis": "Das Portfolio zeigt die Stationen BOSS, MANGO, Baldessarini und Mustang, dazu die eigenen Konzepte ALPHA TAURI und NEON sowie Philosophy, About, CV und Contact. Die Logo-Leiste FORMER BRANDS führt nur Marken, für die er tatsächlich gearbeitet hat.\n\nProjekte, Bilder und CV-Stationen pflegt der Kunde einzeln im WordPress-Backend, die Oberfläche dort ist auf Deutsch. Theme und Schriften liegen auf dem Webserver der Seite, eine Baukasten-Plattform mit Abo braucht sie nicht."
    }
  },
  {
    "slug": "taxi-moennigmann",
    "title": "Taxi Mönnigmann",
    "tagline_en": "Taxi company in Leer (Ostfriesland) — day and night, 20+ years",
    "tagline_de": "Taxiunternehmen in Leer (Ostfriesland) — Tag und Nacht, seit über 20 Jahren",
    "year": 2026,
    "url": "https://taxi-moennigmann.de",
    "status": "live",
    "tags": [
      "Corporate",
      "Astro",
      "DE/EN/Plattdeutsch",
      "Hero Video"
    ],
    "summary_en": "Corporate website for a taxi company in Leer and Ostfriesland. Astro static build, Markdown news, hero video, 6 service sections from Krankenfahrten to Zeitlosreisen. Trilingual DE/EN/Plattdeutsch, no cookies or tracking, hosted on ALL-INKL.",
    "summary_de": "Firmenwebsite eines Taxiunternehmens in Leer und Ostfriesland. Astro-Static-Build, Markdown-News, Hero-Video, 6 Leistungsbereiche von Krankenfahrten bis Zeitlosreisen. Dreisprachig DE/EN/Plattdeutsch, ohne Cookies und Tracking, Hosting bei ALL-INKL.",
    "screenshot": "assets/taxi-moennigmann-site.jpg",
    "screenshot_2x": "assets/taxi-moennigmann-site.jpg",
    "mark": "taxi-moennigmann",
    "layout": "feature",
    "featured": true,
    "order": 3,
    "case_de": {
      "ausgangslage": "Taxi Mönnigmann fährt seit über 20 Jahren in Leer und ganz Ostfriesland: Stadttaxi rund um die Uhr, Krankenfahrten, Inklusionstaxi, Flughafentransfers, Schülertransporte und Oldtimerfahrten für Hochzeiten. Unter den neun Wettbewerbern aus Leer und Ostfriesland, die ich vorab ausgewertet habe, bot keiner ein Inklusionstaxi an. Diese Stärke sollte die neue Website klar zeigen.\n\nDas Briefing des Unternehmens umfasste acht Bereiche und stellte klare Anforderungen: barrierefrei, dreisprachig mit Deutsch, Englisch und Plattdeutsch, optimiert für das Smartphone, kurze Ladezeiten und bewegte Bilder im Hintergrund. Ein Kontaktformular war ausdrücklich nicht gewünscht. Telefon und E-Mail sollten direkt anklickbar sein.",